{
  "$comment": [
    "不可变 RuleManifest —— 《选币榜Y》一致性等式的左半边（文档 B §3.1/§5.1）。",
    "发布后只增不改：任何逻辑变化必须递增 rule_revision 并发新文件，",
    "禁止同名版本静默覆盖（文档 A §20【上线阻断】）。",
    "effective_from_* 只允许落在 00:00 UTC 周期边界（文档 B §3.3）。"
  ],
  "schema": "rule-manifest-v1",
  "board_key": "y",
  "parameter_version": "param-v2.0.0-screener-y",
  "rule_revision": "y-v2.0.0-r4",
  "config_hash": "sha256:e304b95da19bd49acd5348f24de8860be170a4587927566848b65d699555d4ef",
  "asset_mapping_version": "cg-map",
  "mcap_mapping_version": "mcap-216-v2.0.0-r1",
  "mapping_hash": "sha256:da14429d62614a22096fa15cc93a66c9465e4d62597737844e97c552dc6d1689",
  "code_commit": "22b0e511da3178e87d7adf51a25b37ee881a72ce",
  "indicator_version": "g1g2g3g4-sm-dual-path",
  "data_contract_version": "raw-input-contract-v1",
  "universe_policy_version": "binance-usdt-perp-v1",
  "effective_from_utc": "2026-09-05T00:00:00Z",
  "effective_from_scan_id": "20260905-000",
  "feature_flags": {
    "ENABLE_MCAP_ZONE": true,
    "ENABLE_TARGET_WEIGHTS": true,
    "ENABLE_MCAP_EFFECTIVE_ZONE": true
  },
  "dmr_executable": false,
  "consumable_by_dmr": false,
  "param_hash": "pf1_fcea251fa94122fe",
  "notes": [
    "《复盘选币》分区谓词由 effective_zone 改读 final_zone —— 账本向板面看齐。",
    "背景：final_zone（主导层 P1/P2/P3 + SS×市值互印证之后的最终分区，板面显示的就是它）由 da8b4d7 引入，但该提交未同步修改 review_replay 的分区谓词，账本一直读 effective_zone。",
    "实测 20260903–20260904 共 140 节点 / 143986 行样本中 1290 次（0.90%）两者不同：QUALIFIED→WATCH 1103 / CONFIRMED→QUALIFIED 182 / CONFIRMED→WATCH 5，差异恰好落在确认区与 DMR 的进出边界，即复盘胜率的口径。",
    "裁决（用户 2026-09-04）：账本向板面看齐，且只从 2026-09-05T00:00:00Z 起生效，不重建历史账本。",
    "实现：review_replay.FINAL_ZONE_FROM_SCAN_ID=20260905-000，边界之前继续按 effective_zone 回放，因此已验收的历史数字逐字节不变（K9 digest 1b3b8d1cfbffa780 未变）。",
    "本 revision 与 r3 的 config_hash 相同：改动在规则内核代码，不在配置。"
  ],
  "manifest_hash": "sha256:9f8964b48e9707a7cf1604d7497494daf94339cf116ff40b92b6a7dede7dbe5e"
}
